{
  "schema_version": "velaserve.preflight-binding/v3",
  "repository_commit": "aaaaaaaaaaaaaaaaaaaaaaaaaaaaaaaaaaaaaaaa",
  "aws_account_id": "123456789012",
  "aws_region": "us-west-2",
  "cluster_arn": "arn:aws:eks:us-west-2:123456789012:cluster/velaserve-z0",
  "namespace": "velaserve-z0",
  "endpoint": "https://gateway.example/v1/chat/completions",
  "gateway_uid": "gateway-uid",
  "http_route_uid": "route-uid",
  "gateway_data_plane": {"namespace":"envoy-gateway-system","selector":"gateway=velaserve","container":"envoy","image":"123456789012.dkr.ecr.us-west-2.amazonaws.com/envoy@sha256:aaaaaaaaaaaaaaaaaaaaaaaaaaaaaaaaaaaaaaaaaaaaaaaaaaaaaaaaaaaaaaaa","spec_sha256":"bbbbbbbbbbbbbbbbbbbbbbbbbbbbbbbbbbbbbbbbbbbbbbbbbbbbbbbbbbbbbbbb","pods":[{"name":"envoy-0","uid":"envoy-uid-0","node_name":"gateway-node","image":"123456789012.dkr.ecr.us-west-2.amazonaws.com/envoy@sha256:aaaaaaaaaaaaaaaaaaaaaaaaaaaaaaaaaaaaaaaaaaaaaaaaaaaaaaaaaaaaaaaa","restart_count":0}]},
  "gateway_controller": {"namespace":"envoy-gateway-system","selector":"app=envoy-gateway","container":"envoy-gateway","image":"123456789012.dkr.ecr.us-west-2.amazonaws.com/envoy-gateway@sha256:bbbbbbbbbbbbbbbbbbbbbbbbbbbbbbbbbbbbbbbbbbbbbbbbbbbbbbbbbbbbbbbb","spec_sha256":"cccccccccccccccccccccccccccccccccccccccccccccccccccccccccccccccc","pods":[{"name":"envoy-gateway-0","uid":"envoy-gateway-uid-0","image":"123456789012.dkr.ecr.us-west-2.amazonaws.com/envoy-gateway@sha256:bbbbbbbbbbbbbbbbbbbbbbbbbbbbbbbbbbbbbbbbbbbbbbbbbbbbbbbbbbbbbbbb","restart_count":0}]},
  "preregistration_sha256": "bbbbbbbbbbbbbbbbbbbbbbbbbbbbbbbbbbbbbbbbbbbbbbbbbbbbbbbbbbbbbbbb",
  "calibration_sha256": "cccccccccccccccccccccccccccccccccccccccccccccccccccccccccccccccc",
  "benchmark_profile_sha256": "7777777777777777777777777777777777777777777777777777777777777777",
  "profile_calibration_sha256": "8888888888888888888888888888888888888888888888888888888888888888",
  "routing_sha256": "4444444444444444444444444444444444444444444444444444444444444444",
  "router_config_sha256": "5555555555555555555555555555555555555555555555555555555555555555",
  "router_config_invariant_sha256": "ffffffffffffffffffffffffffffffffffffffffffffffffffffffffffffffff",
  "zeroing_contract_sha256": "6666666666666666666666666666666666666666666666666666666666666666",
  "active_arm": "arm-b-load-aware-p2p",
  "transport": "tcp",
  "model": {
    "release": "velaserve-model", "selector": "app=velaserve-model", "container": "vllm", "workload": "velaserve-model", "service": "velaserve-model", "service_uid": "model-service-uid", "service_spec_sha256": "6666666666666666666666666666666666666666666666666666666666666666", "id": "Qwen/Qwen3-8B",
    "revision": "dddddddddddddddddddddddddddddddddddddddd", "image": "123456789012.dkr.ecr.us-west-2.amazonaws.com/model@sha256:1111111111111111111111111111111111111111111111111111111111111111", "image_provenance":{"component":"vllm","upstream_commit":"dddddddddddddddddddddddddddddddddddddddd","patch_sha256s":["aaaaaaaaaaaaaaaaaaaaaaaaaaaaaaaaaaaaaaaaaaaaaaaaaaaaaaaaaaaaaaaa"],"dirty":false},
    "sidecar_container": "routing-proxy", "sidecar_image": "123456789012.dkr.ecr.us-west-2.amazonaws.com/sidecar@sha256:0000000000000000000000000000000000000000000000000000000000000000", "sidecar_provenance":{"component":"routing-sidecar","upstream_commit":"eeeeeeeeeeeeeeeeeeeeeeeeeeeeeeeeeeeeeeee","patch_sha256s":["bbbbbbbbbbbbbbbbbbbbbbbbbbbbbbbbbbbbbbbbbbbbbbbbbbbbbbbbbbbbbbbb","cccccccccccccccccccccccccccccccccccccccccccccccccccccccccccccccc"],"dirty":false},
    "minimum_replicas": 6, "maximum_replicas": 8, "block_size": 64, "cpu_offload_bytes": 17179869184, "engine_port": 8200, "proxy_port": 8000, "p2p_port": 7777, "kv_events_port": 5556,
    "runtime_contract_sha256": "5555555555555555555555555555555555555555555555555555555555555555", "network_policy_sha256": "4444444444444444444444444444444444444444444444444444444444444444", "developer_api_enabled": true, "reset_external": true, "spec_sha256": "7777777777777777777777777777777777777777777777777777777777777777",
    "pods": [
      {"name":"model-0","uid":"m0","image":"123456789012.dkr.ecr.us-west-2.amazonaws.com/model@sha256:1111111111111111111111111111111111111111111111111111111111111111","node_name":"node-0","restart_count":0},
      {"name":"model-1","uid":"m1","image":"123456789012.dkr.ecr.us-west-2.amazonaws.com/model@sha256:1111111111111111111111111111111111111111111111111111111111111111","node_name":"node-1","restart_count":0},
      {"name":"model-2","uid":"m2","image":"123456789012.dkr.ecr.us-west-2.amazonaws.com/model@sha256:1111111111111111111111111111111111111111111111111111111111111111","node_name":"node-2","restart_count":0},
      {"name":"model-3","uid":"m3","image":"123456789012.dkr.ecr.us-west-2.amazonaws.com/model@sha256:1111111111111111111111111111111111111111111111111111111111111111","node_name":"node-3","restart_count":0},
      {"name":"model-4","uid":"m4","image":"123456789012.dkr.ecr.us-west-2.amazonaws.com/model@sha256:1111111111111111111111111111111111111111111111111111111111111111","node_name":"node-4","restart_count":0},
      {"name":"model-5","uid":"m5","image":"123456789012.dkr.ecr.us-west-2.amazonaws.com/model@sha256:1111111111111111111111111111111111111111111111111111111111111111","node_name":"node-5","restart_count":0}
    ],
    "sidecar_pods": [
      {"name":"model-0","uid":"m0","image":"123456789012.dkr.ecr.us-west-2.amazonaws.com/sidecar@sha256:0000000000000000000000000000000000000000000000000000000000000000","node_name":"node-0","restart_count":0},
      {"name":"model-1","uid":"m1","image":"123456789012.dkr.ecr.us-west-2.amazonaws.com/sidecar@sha256:0000000000000000000000000000000000000000000000000000000000000000","node_name":"node-1","restart_count":0},
      {"name":"model-2","uid":"m2","image":"123456789012.dkr.ecr.us-west-2.amazonaws.com/sidecar@sha256:0000000000000000000000000000000000000000000000000000000000000000","node_name":"node-2","restart_count":0},
      {"name":"model-3","uid":"m3","image":"123456789012.dkr.ecr.us-west-2.amazonaws.com/sidecar@sha256:0000000000000000000000000000000000000000000000000000000000000000","node_name":"node-3","restart_count":0},
      {"name":"model-4","uid":"m4","image":"123456789012.dkr.ecr.us-west-2.amazonaws.com/sidecar@sha256:0000000000000000000000000000000000000000000000000000000000000000","node_name":"node-4","restart_count":0},
      {"name":"model-5","uid":"m5","image":"123456789012.dkr.ecr.us-west-2.amazonaws.com/sidecar@sha256:0000000000000000000000000000000000000000000000000000000000000000","node_name":"node-5","restart_count":0}
    ],
    "tokenizer_verified_pod_uids": ["m0", "m1", "m2", "m3", "m4", "m5"]
  },
  "epp": {"selector":"llm-d-router-gateway=velaserve-epp","container":"epp","image":"123456789012.dkr.ecr.us-west-2.amazonaws.com/epp@sha256:2222222222222222222222222222222222222222222222222222222222222222","image_provenance":{"component":"epp","upstream_commit":"eeeeeeeeeeeeeeeeeeeeeeeeeeeeeeeeeeeeeeee","patch_sha256s":["bbbbbbbbbbbbbbbbbbbbbbbbbbbbbbbbbbbbbbbbbbbbbbbbbbbbbbbbbbbbbbbb","cccccccccccccccccccccccccccccccccccccccccccccccccccccccccccccccc"],"dirty":false},"proxy_container":"envoy-proxy","proxy_image":"docker.io/envoyproxy/envoy-distroless@sha256:4444444444444444444444444444444444444444444444444444444444444444","proxy_pods":[{"name":"epp-0","uid":"e0","node_name":"epp-node","image":"docker.io/envoyproxy/envoy-distroless@sha256:4444444444444444444444444444444444444444444444444444444444444444","restart_count":0}],"replicas":1,"min_cached_token_delta":128,"spec_sha256":"8888888888888888888888888888888888888888888888888888888888888888","pods":[{"name":"epp-0","uid":"e0","node_name":"epp-node","image":"123456789012.dkr.ecr.us-west-2.amazonaws.com/epp@sha256:2222222222222222222222222222222222222222222222222222222222222222","restart_count":0}]},
  "condition_controller": {"selector":"app=controller","container":"condition-controller","image":"123456789012.dkr.ecr.us-west-2.amazonaws.com/velaserve@sha256:3333333333333333333333333333333333333333333333333333333333333333","image_provenance":{"component":"velaserve","repository_commit":"aaaaaaaaaaaaaaaaaaaaaaaaaaaaaaaaaaaaaaaa","dirty":false},"revision":"aaaaaaaaaaaaaaaaaaaaaaaaaaaaaaaaaaaaaaaa","apply_timeout_seconds":900,"spec_sha256":"9999999999999999999999999999999999999999999999999999999999999999","pods":[{"name":"controller-0","uid":"c0","node_name":"control-node","image":"123456789012.dkr.ecr.us-west-2.amazonaws.com/velaserve@sha256:3333333333333333333333333333333333333333333333333333333333333333","restart_count":0}]},
  "condition_driver": {"endpoint":"http://condition-driver.velaserve-z0.svc.cluster.local:8083/v1/conditions/apply","gateway_chat_url":"https://gateway.example/v1/chat/completions","selector":"app=condition-driver","container":"condition-driver","image":"123456789012.dkr.ecr.us-west-2.amazonaws.com/velaserve@sha256:3333333333333333333333333333333333333333333333333333333333333333","image_provenance":{"component":"velaserve","repository_commit":"aaaaaaaaaaaaaaaaaaaaaaaaaaaaaaaaaaaaaaaa","dirty":false},"spec_sha256":"eeeeeeeeeeeeeeeeeeeeeeeeeeeeeeeeeeeeeeeeeeeeeeeeeeeeeeeeeeeeeeee","config_sha256":"ffffffffffffffffffffffffffffffffffffffffffffffffffffffffffffffff","load_profiles_sha256":"2222222222222222222222222222222222222222222222222222222222222222","load_calibration_sha256":"3333333333333333333333333333333333333333333333333333333333333333","control_secret_sha256":"cccccccccccccccccccccccccccccccccccccccccccccccccccccccccccccccc","drain_timeout_seconds":120,"drain_poll_milliseconds":500,"endpoints":[